<?xml version="1.0" encoding="iso-8859-1" standalone="no"?>
<!DOCTYPE isaarcpf SYSTEM "isaar.dtd">
<isaarcpf> 
  <aarheader audience="internal" langencoding="ISO 639"
	aarstatus="edited-full-draft"> 
	 <aarid source="GB-0237" type="FPI"> "-//Edinburgh University Library
		Special Collections Division :: Archival Authority Records//DOCUMENT GB-0237-
		NAHSTE-P0179-20020129 //EN" </aarid> 
	 <filedesc> 
		<titlestmt> 
		  <titleproper>GB 0237 NAHSTE P0179</titleproper> 
		  <subtitle>Murchison | Sir | Roderick Impey | 1792-1871 | baronet |
			 professor of geology, University of Edinburgh</subtitle> 
		  <author>Compiled for the NAHSTE project by Andrew Thomson, Edinburgh
			 University Library Special Collections Division, 29 January 2002</author> 
		</titlestmt> 
		<publicationstmt> 
		  <publisher>Edinburgh University Library Special Collections
			 Division</publisher> 
		  <address> 
			 <addressline>The University of Edinburgh</addressline> 
			 <addressline>George Square</addressline> 
			 <addressline>Edinburgh EH8 9LJ</addressline> 
			 <addressline>Scotland</addressline> 
			 <addressline>United Kingdom</addressline> 
		  </address> 
		  <date type="single" normal="20020129">29 January 2002</date> 
		</publicationstmt> 
	 </filedesc> 
	 <profiledesc> 
		<creation>XML generated using the ISAAR(CPF) DTD and XMetal template
		  prepared, as part of the NAHSTE project, in collaboration with the GASHE
		  project, by Sarah Higgins, Edinburgh University Library Special Collections
		  Division, 2001, with assistance from Pete Johnston, Lesley Richmond and Moira
		  Rankin, Glasgow University Archive Services. </creation> 
		<langusage> 
		  <language>EN</language> 
		</langusage> 
	 </profiledesc> 
	 <revisiondesc> 
		<list> 
		  <item>No revisions to date</item> 
		</list> 
	 </revisiondesc> 
  </aarheader> 
  <frontmatter> 
	 <titlepage> 
		<titleproper>GB 0237 NAHSTE P0179</titleproper> 
		<subtitle>Murchison | Sir | Roderick Impey | 1792-1871| baronet |
		  professor of geology, University of Edinburgh</subtitle> 
		<author>Compiled for the NAHSTE project by Andrew Thomson , Edinburgh
		  University Library Special Collections Division, 29 January 2002</author> 
		<publisher>Edinburgh University Library Special Collections
		  Division</publisher> 
		<date type="single" normal="20020129">29 January 2002</date> 
	 </titlepage> 
  </frontmatter> 
  <aar id="GB-0237-NAHSTE-P0179"> 
	 <authcontrolarea> 
		<head>AUTHORITY CONTROL AREA</head> 
		<unitid label="Identity Code" encodinganalog="isaar11" type="NAHSTE"
		 repositorycode="0237">GB 0237 NAHSTE P0179</unitid> 
		<authentry encodinganalog="isaar13" label="Authority Entry"
		 authfilenumber="GB 0237 NAHSTE P0179" normal="Gregory, David">Murchison | Sir |
		  Roderick Impey | 1792-1871| baronet | professor of geology, University of
		  Edinburgh</authentry> 
	 </authcontrolarea> 
	 <infoarea encodinganalog="isaar2"> 
		<head>INFORMATION AREA</head> 
		<occsphere encodinganalog="isaar226"> 
		  <head>Occupation, Sphere of Activity</head> 
		  <p>Sir Roderick Impey Murchison was born into a wealthy Highland
			 family. He was sent to military college and fought in the Peninsular War. Once
			 he had given up his passion for fox-hunting (he became one of the greatest fox
			 hunters in the midland counties), Murchison, at the age of 32, turned his
			 attention to science, devoting the rest of his life to geology. Sir Humphrey
			 Davy persuaded him to attend lectures at the Royal Institution. He also joined
			 the Geological Society of London, where he gave his first paper in 
			 <date normal="1825" type="single">1825</date>. Between 
			 <date normal="1825/1831" type="inclusive">1825-1831</date> Murchison
			 explored large parts of England, Scotland and France accumulating material for
			 three of his own memoirs, as well as two more written in conjunction with Adam
			 Sedgwick. </p> 
		  <p>In 
			 <date normal="1831" type="single">1831</date> at the suggestion of
			 William Buckland, he travelled to South Wales and the Welsh Borderland, where
			 he conducted research into the mass of rocks known as 'greywacke' rocks,
			 underlying the Old Red Sandstone. Murchison produced a sequence of the rocks
			 and the fossils contained within them, and these results were ultimately pulled
			 together to form his great work of 
			 <date normal="1839" type="publication">1839</date>,
			 <bibref><title>The Silurian System</title></bibref>. The establishment of the
			 silurian system was followed a year later by that of the Devonian System,
			 founded along with Alan Sedgwick. </p> 
		  <p>Murchison then went on expedition to Russia, Scandinavia and
			 Finland, and collaborated with Von Keyserling and De Verneuil in The Geology of
			 Russia and the Ural Mountains (<date normal="1845" type="single">1845</date>).
			 In 
			 <date normal="1841" type="single">1841</date> he proposed the
			 establishment of the Permian System, based upon his Russian explorations. In 
			 <date normal="1855" type="appointmentdate">1855</date> he succeeded
			 Sir Henry de la Beche as Director-General of the Geological Survey, the most
			 important official post in British geology. Murchison eventually endowed by
			 bequest the Society's second highest award, the Murchison Medal, and had helped
			 to establish the Murchison Professorship of Geology at the University of
			 Edinburgh.</p> 
		</occsphere> 
		<relships encodinganalog="isaar228"> 
		  <head>Relationships</head> 
		  <p>None</p> 
		</relships> 
		<otherinfo encodinganalog="isaar229"> 
		  <head>Other Significant Information</head> 
		  <p>Notable publications:</p> 
		  <p><bibref><title>The Silurian System</title>, (<imprint><date
			 type="publication" normal="1839"
			 certainty="certain">1839</date>)</imprint></bibref> </p> 
		  <p><bibref><title>The Geology of Russia and the Ural Mountains</title>,
			 ( <imprint><date type="publication" normal="1845"
			 certainty="certain">1845</date>)</imprint></bibref> </p> 
		</otherinfo> 
		<honqual encodinganalog="nahste2210"> 
		  <head>Honours, Qualifications and Appointments</head> 
		  <p><date type="appointmentdate" normal="1826">1826</date>: Elected
			 Fellow, Royal Society (FRS)</p> 
		  <p><date type="appointmentdate" normal="1831">1831</date>: Appointed
			 President, Geological Society of London</p> 
		  <p><date type="appointmentdate" normal="1842/1843">1842-1843</date>:
			 Appointed President, Geological Society of London</p> 
		  <p><date type="appointmentdate" normal="1843">1843</date>: Appointed
			 President, Royal Geographical Society of London</p> 
		  <p><date type="appointmentdate" normal="1846">1846</date>: Created
			 Knight Commander, Order of the Bath (KCB)</p> 
		  <p><date type="appointmentdate" normal="1846">1846</date>: Appointed
			 President, British Association</p> 
		  <p><date type="appointmentdate" normal="1855">1855</date>: Appointed
			 Director-General, Geological Survey</p> 
		  <p><date type="single" normal="1864">1864</date>: Awarded Wollaston
			 Medal of the Geological Society</p> 
		  <p><date type="single" normal="1866">1866</date>: Created Baronet</p> 
		</honqual> 
	 </infoarea> 
	 <notearea encodinganalog="ISAAR3"> 
		<archnote encodinganalog="isaar31"> 
		  <head>Notes</head> 
		  <p>List of sources for the biographical information:</p> 
		  <p> <bibref>
			 <persname source="ncarules" normal="Gillispie, Charles C"
			 role="editor">Gillispie, Charles C</persname>, <title
			 render="italic">Dictionary of scientific biography, vol vii</title>, (<imprint>
			 <geogname source="lcsh" authfilenumber="483"
			 normal="New York (N.Y.), United States">New York </geogname>, 
			 <publisher>Scribner's</publisher>, 
			 <date type="publication" normal="1972"
			  certainty="certain">1972</date>)</imprint></bibref></p> 
		  <p> <bibref><title render="italic">Lefalophodon, A history of
			 evolutionary biology website</title>, (
			 <extref
			  href="http://www.nceas.ucsb.edu/~alroy/lefa/Murchison.html">http://www.nceas.ucsb.edu/~alroy/lefa/Murchison.html</extref>
			 <imprint>, 
			 <date type="publication" normal="1990/1999"
			  certainty="uncertain">1990s</date>)</imprint></bibref></p> 
		  <p> <bibref><title render="italic">Encyclopaedia Britannica, vol
			 15</title>, (<imprint>
			 <geogname source="lcsh" authfilenumber="502"
			  normal="Chicago (Illinois), United States">Chicago</geogname>, 
			 <publisher>William Benton</publisher>, 
			 <date type="publication" normal="1964"
			  certainty="certain">1964</date>)</imprint></bibref></p> 
		</archnote> 
		<rules encodinganalog="isaar32"> 
		  <head>Rules or Conventions</head> 
		  <p>Authority record created according to the<bibref><corpname
			 normal="National Council on Archives">National Council on
			 Archives</corpname><title>Rules for the Construction of Personal, Place and
			 Corporate Names (NCA Rules)</title><imprint> 
			 <date type="publication" normal="1997">1997</date></imprint></bibref>
			 and <bibref><corpname normal="International Council on Archives">International
			 Council on Archives: Ad Hoc Committee on Descriptive
			 Standards</corpname><title>International Standard Archival Authority Record for
			 Corporate Bodies, Persona and Families (ISAAR)CPF</title><imprint> 
			 <date type="publication"
			  normal="1995">1995</date></imprint></bibref></p> 
		</rules> 
		<creationdate encodinganalog="isaar33"> 
		  <p>Personal name authority record compiled for the NAHSTE project by
			 <persname role="archivist" normal="Thomson, Andrew">Andrew Thomson</persname>,
			 Edinburgh University Library Special Collections Division, 
			 <date type="single" normal="20020129">29 January
				2002</date></p></creationdate> 
	 </notearea> 
  </aar>
</isaarcpf>
